{
  "schema_version": "1.0.0",
  "project_id": "dry-run-001",
  "created_at": "2026-09-22T10:00:00-03:00",
  "status": "complete",
  "shots": [
    {
      "shot_id": "shot-01",
      "script_block_order": 1,
      "description": "Close-up no rosto de uma pessoa mostrando pele ressecada e lábios rachados, em ambiente que sugere ar seco (ex: perto de aquecedor/ventilador ligado, luz um pouco amarelada e desconfortável). [Rodada de otimização de custo] Mantido inalterado.",
      "duration_seconds": 1.4,
      "shot_type": "lifestyle",
      "higgsfield_model": "seedance_2_5",
      "prompt": "Extreme close-up portrait, dry cracked lips and slightly flaky skin on a person's face, warm dim indoor lighting with a subtle uncomfortable yellowish cast, faint haze in the air suggesting a heater running nearby, subtle handheld camera micro-movement, shallow depth of field, realistic skin texture, no text overlay, vertical 9:16 composition, UGC smartphone-style cinematography, slightly uneasy mood.",
      "needs_review": false
    },
    {
      "shot_id": "shot-02",
      "script_block_order": 1,
      "description": "Texto de impacto sobreposto na tela reforçando a pergunta do gancho (ex.: 'AR SECO DE NOVO?'), mantendo a cena anterior ao fundo levemente desfocada. [OTIMIZAÇÃO DE CUSTO] Geração própria eliminada — este shot deixa de ser um asset Higgsfield distinto e passa a ser resolvido inteiramente como composição no Remotion sobre o frame já gerado de shot-01. Fusion/resolution note: decisão do Orchestrator (rodada de auditoria de custo dry-run-001) elimina 1 geração Higgsfield reaproveitando o frame de shot-01 diretamente na composição.",
      "duration_seconds": 1.4,
      "shot_type": "text_on_screen",
      "higgsfield_model": "NONE — reused: Remotion aplica blur + espaço para texto sobre o asset gerado de shot-01, sem geração nova",
      "prompt": "Instrução de composição para o composition-subagent (Remotion, sem geração Higgsfield): pegar o frame/clipe já gerado de shot-01 (close-up de pele ressecada e lábios rachados) e, no ponto da timeline correspondente a shot-02, aplicar um blur gaussiano leve sobre toda a imagem para reduzir contraste e distração visual, mantendo a cena reconhecível ao fundo; reservar uma área negativa limpa no terço superior do frame (sem elementos de alto contraste nessa faixa) para o overlay de texto de impacto 'AR SECO DE NOVO?' que será adicionado pelo caption-subagent; nenhum novo asset visual é gerado — reaproveita-se o mesmo frame de shot-01.",
      "needs_review": false
    },
    {
      "shot_id": "shot-03",
      "script_block_order": 2,
      "description": "Plano fechado do mini umidificador sobre uma mesa, câmera captando o início da neblina saindo do bocal do produto. [Rodada de otimização de custo] Mantido inalterado.",
      "duration_seconds": 2.5,
      "shot_type": "product_closeup",
      "higgsfield_model": "seedance_2_5",
      "prompt": "Tight close-up product shot on a wooden desk, a compact oval mini USB humidifier in matte white with a subtle silver trim, top mist nozzle just beginning to release a thin fresh cool mist that curls upward, soft diffused studio lighting from the side, shallow depth of field with the mist in sharp focus, clean minimal desk background slightly out of focus, no visible text or logo on the product, vertical 9:16 composition, realistic product photography look with gentle camera motion.",
      "needs_review": false
    },
    {
      "shot_id": "shot-04",
      "script_block_order": 2,
      "description": "Close-up na base do umidificador mostrando a luz interna alternando entre as sete cores, destacando o efeito ambiente. [OTIMIZAÇÃO DE CUSTO — FUNDIDO com shot-09] Usa os primeiros ~2.0s do clipe compartilhado 'shot-04-09' (ciclo de cores do LED). O trecho final do mesmo clipe (nível de água baixando + autodesligamento) é usado na posição de shot-09 na timeline. Fusion note: shot-04 e shot-09 referenciam o mesmo asset_id ('shot-04-09') e o mesmo prompt; o composition-subagent do Remotion corta o mesmo clipe em dois pontos da timeline (shot-04: primeiros ~2.0s; shot-09: trecho final ~2.3s). Esta fusão não se enquadra na regra needs_review de corte de cena/local/sujeito (aplicada a shot-08 e shot-13 antes de sua eliminação): é uma evolução contínua do mesmo objeto no mesmo enquadramento, sem troca de câmera/local/sujeito (critério CONT-05, ver continuity report). Risco técnico residual de qualidade de geração (continuidade das duas fases dentro de um único take de 8s) reconhecido e atribuído ao asset-validation-subagent para verificação obrigatória após geração real.",
      "duration_seconds": 2.0,
      "shot_type": "product_closeup",
      "higgsfield_model": "seedance_2_5",
      "prompt": "Continuous single-take close-up product video, one uninterrupted shot: opens on an extreme close-up of the base of a compact oval matte white mini USB humidifier with a subtle silver trim, resting on a dark surface in a dim room — a diffused LED light ring at the base smoothly cycles through seven ambient colors (red, orange, yellow, green, blue, indigo, violet), soft colored glow bleeding onto the surface below, mist faintly visible above the frame, slow smooth camera push-in, cozy ambient mood (use the first ~2 seconds of this segment for the 'LED color cycling' moment). Within the same continuous take, the camera settles and the frame reveals the translucent water reservoir on the side of the same humidifier, water level slowly and visibly dropping to near-empty; immediately after, the ambient LED light ring gently fades out and switches off on its own (auto shut-off), desk surface remains clean and dry with no spill (use the final ~2.3 seconds of this segment for the 'water level dropping + auto shut-off' moment). Same product framing and consistent silver trim visible throughout both moments, soft even lighting, shallow depth of field, no visible text or logo on the product, vertical 9:16 composition. [Asset compartilhado: asset_id 'shot-04-09', gerado como um único clipe contínuo de 8s (mode t2v, seedance_2_5, 9:16, 1080p); o Remotion recorta cada trecho na posição correta da timeline.]",
      "needs_review": false
    },
    {
      "shot_id": "shot-05",
      "script_block_order": 2,
      "description": "Plano mais aberto do ambiente (quarto ou mesa de trabalho) com o produto ligado, neblina visível e luz colorida criando atmosfera aconchegante. [OTIMIZAÇÃO DE CUSTO — FUNDIDO com shot-10] Usa a imagem compartilhada 'shot-05-10' na posição de bloco 1, enfatizando o momento 'ambiente aconchegante'. Fusion note: shot-05 e shot-10 referenciam o mesmo asset_id ('shot-05-10') e o mesmo prompt; o Remotion reaproveita a mesma imagem em dois pontos da timeline — bloco 1 ('ambiente aconchegante') e bloco 3 ('decoração organizada'). Esta é a única e primeira aparição planejada de 'shot-05-10'; uma segunda aparição ocorre em shot-10 e nenhuma terceira aparição é planejada (ver shot-13).",
      "duration_seconds": 1.9,
      "shot_type": "lifestyle",
      "higgsfield_model": "gpt_image_2 (via higgsfield product-photoshoot, mode lifestyle_scene)",
      "prompt": "A cozy, softly lit bedroom / home-office desk corner at dusk, tastefully organized and tidy: a compact oval matte white mini USB humidifier with a subtle silver trim sits centered on the desk, actively releasing a soft visible mist, ambient LED base glowing in a warm color (soft violet or blue) that gently lights nearby décor items placed neatly around it — a small potted plant, a simple picture frame, and a warm desk lamp — warm inviting atmosphere that reads simultaneously as cozy ambiance and as quiet, organized minimalist decoration, shallow depth of field with the product in sharp focus, soft natural window light mixed with the product's ambient glow, vertical 9:16 composition, no visible text or logo on the product, editorial home-lifestyle photography style. [Asset compartilhado: asset_id 'shot-05-10', gerado via higgsfield product-photoshoot mode lifestyle_scene, 9:16, 2k, reaproveitado também em shot-10.]",
      "needs_review": false
    },
    {
      "shot_id": "shot-06",
      "script_block_order": 3,
      "description": "Produto em destaque com texto na tela reforçando os números-chave ('300ml' e 'até 8 horas'), reservatório de água visível. [OTIMIZAÇÃO DE CUSTO — FUNDIDO com shot-12] Usa a imagem compartilhada 'shot-06-12', aproveitando o espaço negativo SUPERIOR para o overlay '300ml / até 8h'. Fusion note: shot-06 e shot-12 referenciam o mesmo asset_id ('shot-06-12') e o mesmo prompt; a imagem tem espaço negativo limpo tanto no topo quanto na base, e o Remotion reaproveita a mesma imagem em dois pontos da timeline com overlays diferentes. NÃO renderizar '300ml' / '8 horas' ou qualquer texto/banner na imagem gerada — todo texto/CTA vem como overlay do Remotion (caption-subagent).",
      "duration_seconds": 2.5,
      "shot_type": "text_on_screen",
      "higgsfield_model": "gpt_image_2 (via higgsfield product-photoshoot, mode product_shot)",
      "prompt": "Clean centered studio product shot of a compact oval matte white mini USB humidifier with a subtle silver trim, three-quarter angle, translucent water reservoir on the side clearly visible showing the water level, soft even studio lighting on a neutral light-gray studio background, the product occupies the clear middle band of the frame, with generous clean negative space in the upper third of the frame reserved for a numeric text overlay (e.g. '300ml / até 8h') and additional generous clean negative space in the bottom third of the frame reserved for a call-to-action banner overlay, sharp focus, no text, no logos, no watermark, vertical 9:16 composition, polished e-commerce hero-shot quality. [Asset compartilhado: asset_id 'shot-06-12', gerado via higgsfield product-photoshoot mode product_shot, 9:16, 2k, reaproveitado também em shot-12.]",
      "needs_review": false
    },
    {